<?xml version="1.0" encoding="UTF-8"?>
<ioc:beans xmlns:ioc="http://www.gotoeasy.top/schema/beans"
	xmlns:xsi="http://www.w3.org/2001/XMLSchema-instance"
	xsi:schemaLocation="http://www.gotoeasy.top/schema/beans gotoeasy-beans.xsd">

	<!-- 按默认构造方法创建Bean -->
	<bean id="student" class="top.gotoeasy.sample.Student" />

	<!-- 简单类型 -->
	<bean id="age" class="int" value="20" />

	<!-- 单纯引用 -->
	<bean id="zhangsan" ref="student" />

	<!-- 按默认构造方法创建Bean，按指定属性注入 -->
	<bean id="lisi" class="top.gotoeasy.sample.Student">
		<property name="age" ref="age" />
		<property name="phone" value="13812345678" />
	</bean>

	<!-- 按指定构造方法创建Bean -->
	<bean id="wangwu" class="top.gotoeasy.sample.Student">
		<constructor>
			<arg ref="age" />
			<arg class="String" value="13812345678" />
		</constructor>
	</bean>

	<!-- 按指定构造方法创建Bean，按指定属性注入 -->
	<bean id="wangwu" class="top.gotoeasy.sample.Student">
		<constructor>
			<arg class="String" value="13812345678" />
		</constructor>
		<property name="age" ref="age" />
	</bean>

</ioc:beans>
